{
  "$schema": "http://json-schema.org/draft-07/schema#",
  "title": "Six-Axis Political Compass — Actor Definition",
  "description": "Forkable, traceable actor data for the Six-Axis Political Compass. Each file defines one political actor with evidence-backed scores and optional per-question responses.",
  "type": "object",
  "required": ["schemaVersion", "actor", "scores"],
  "properties": {
    "schemaVersion": {
      "type": "string",
      "description": "Schema version in SemVer. Current: 1.1.0",
      "enum": ["1.0.0", "1.1.0"]
    },
    "actor": {
      "type": "object",
      "required": ["name", "slug", "category", "color"],
      "properties": {
        "name": { "type": "string", "description": "Display name" },
        "slug": { "type": "string", "description": "URL-safe identifier, kebab-case" },
        "category": { "type": "string", "description": "e.g. 'UK Political Party', 'Historical Figure'" },
        "activePeriod": { "type": "string", "description": "Optional date range" },
        "color": { "type": "string", "pattern": "^#[0-9A-Fa-f]{6}$", "description": "Hex colour for charts" },
        "version": { "type": "string", "description": "Data file version" },
        "lastUpdated": { "type": "string", "format": "date" },
        "curator": { "type": "string" },
        "contributors": { "type": "array", "items": { "type": "string" } }
      }
    },
    "scores": {
      "type": "object",
      "description": "Map of axis name to Score object",
      "additionalProperties": {
        "type": "object",
        "required": ["value"],
        "properties": {
          "value": {
            "type": "number",
            "minimum": 0,
            "maximum": 10,
            "description": "Score on this axis, 0–10"
          },
          "confidence": {
            "type": "string",
            "enum": ["low", "medium", "high", "very-high"],
            "description": "How confident the curator is in this score"
          },
          "rationale": {
            "type": "string",
            "description": "Short explanation of why this score was assigned"
          },
          "sources": {
            "type": "array",
            "items": {
              "type": "object",
              "required": ["type", "title"],
              "properties": {
                "type": {
                  "type": "string",
                  "enum": ["policy", "legislation", "vote", "speech", "manifesto", "book", "academic", "other"],
                  "description": "Category of evidence"
                },
                "title": { "type": "string" },
                "date": { "type": "string", "format": "date" },
                "url": { "type": "string", "format": "uri" },
                "relevantText": { "type": "string", "description": "Quoted excerpt supporting the score" },
                "citation": { "type": "string", "description": "Full academic or parliamentary citation" }
              }
            }
          }
        }
      }
    },
    "responses": {
      "type": "object",
      "description": "Per-question Likert responses (0–4). Optional: when absent, responses are inferred from axis scores.",
      "properties": {
        "Q1": { "$ref": "#/definitions/response" },
        "Q2": { "$ref": "#/definitions/response" },
        "Q3": { "$ref": "#/definitions/response" },
        "Q4": { "$ref": "#/definitions/response" },
        "Q5": { "$ref": "#/definitions/response" },
        "Q6": { "$ref": "#/definitions/response" },
        "Q7": { "$ref": "#/definitions/response" },
        "Q8": { "$ref": "#/definitions/response" },
        "Q9": { "$ref": "#/definitions/response" },
        "Q10": { "$ref": "#/definitions/response" },
        "Q11": { "$ref": "#/definitions/response" },
        "Q12": { "$ref": "#/definitions/response" },
        "Q13": { "$ref": "#/definitions/response" },
        "Q14": { "$ref": "#/definitions/response" },
        "Q15": { "$ref": "#/definitions/response" },
        "Q16": { "$ref": "#/definitions/response" },
        "Q17": { "$ref": "#/definitions/response" },
        "Q18": { "$ref": "#/definitions/response" },
        "Q19": { "$ref": "#/definitions/response" },
        "Q20": { "$ref": "#/definitions/response" },
        "Q21": { "$ref": "#/definitions/response" },
        "Q22": { "$ref": "#/definitions/response" },
        "Q23": { "$ref": "#/definitions/response" },
        "Q24": { "$ref": "#/definitions/response" }
      },
      "additionalProperties": false
    },
    "dualRegister": {
      "type": "object",
      "description": "Optional dual-register scores: declared (what actors say) vs structural (what actors do).",
      "properties": {
        "protocol": { "type": "string", "description": "Protocol version, e.g. 'Dual-Register Sourcing Protocol v0.2.0'" },
        "period": { "type": "string" },
        "status": { "type": "string" },
        "evidenceQuality": { "type": "string" },
        "declared": { "$ref": "#/definitions/dualRegisterScores" },
        "structural": { "$ref": "#/definitions/dualRegisterScores" },
        "delta": { "$ref": "#/definitions/dualRegisterScores" },
        "confidence": { "$ref": "#/definitions/dualRegisterConfidence" },
        "sources": {
          "type": "object",
          "properties": {
            "declared": { "type": "array", "items": { "$ref": "#/definitions/source" } },
            "structural": { "type": "array", "items": { "$ref": "#/definitions/source" } }
          }
        }
      }
    }
  },
  "definitions": {
    "response": {
      "type": "object",
      "required": ["value"],
      "properties": {
        "value": {
          "type": "integer",
          "minimum": 0,
          "maximum": 4,
          "description": "Likert response: 0=Strongly disagree, 4=Strongly agree"
        },
        "confidence": {
          "type": "string",
          "enum": ["low", "medium", "high", "very-high"]
        },
        "rationale": {
          "type": "string",
          "description": "Why this response was assigned"
        },
        "sources": {
          "type": "array",
          "items": { "$ref": "#/definitions/source" }
        }
      }
    },
    "source": {
      "type": "object",
      "required": ["type", "title"],
      "properties": {
        "type": {
          "type": "string",
          "enum": ["policy", "legislation", "vote", "speech", "manifesto", "book", "academic", "other"]
        },
        "title": { "type": "string" },
        "date": { "type": "string", "format": "date" },
        "url": { "type": "string", "format": "uri" },
        "relevantText": { "type": "string" },
        "citation": { "type": "string" }
      }
    },
    "dualRegisterScores": {
      "type": "object",
      "description": "Map of axis name to 0–10 score",
      "properties": {
        "Cultural": { "type": "number", "minimum": 0, "maximum": 10 },
        "Economic": { "type": "number", "minimum": 0, "maximum": 10 },
        "Military": { "type": "number", "minimum": 0, "maximum": 10 },
        "Sovereignty": { "type": "number", "minimum": 0, "maximum": 10 },
        "Governance": { "type": "number", "minimum": 0, "maximum": 10 },
        "Class": { "type": "number", "minimum": 0, "maximum": 10 }
      }
    },
    "dualRegisterConfidence": {
      "type": "object",
      "description": "Per-axis per-register confidence (0.0–1.0)",
      "patternProperties": {
        "^(Cultural|Economic|Military|Sovereignty|Governance|Class)$": {
          "type": "object",
          "properties": {
            "declared": { "type": "number", "minimum": 0, "maximum": 1 },
            "structural": { "type": "number", "minimum": 0, "maximum": 1 },
            "note": { "type": "string" }
          }
        }
      }
    }
  }
}
