{
  "schemaVersion": "1.1.0",
  "actor": {
    "name": "Franklin D. Roosevelt",
    "slug": "Franklin-D-Roosevelt",
    "category": "World War II Figure",
    "color": "#1565C0",
    "version": "1.0.0",
    "lastUpdated": "2026-05-19",
    "curator": "A Common Enemy Project",
    "contributors": []
  },
  "scores": {
    "Cultural": {
      "value": 4,
      "confidence": "medium",
      "rationale": "To be documented. Researchers are invited to submit citations via pull request.",
      "sources": []
    },
    "Sovereignty": {
      "value": 5,
      "confidence": "medium",
      "rationale": "To be documented. Researchers are invited to submit citations via pull request.",
      "sources": []
    },
    "Military": {
      "value": 8,
      "confidence": "medium",
      "rationale": "To be documented. Researchers are invited to submit citations via pull request.",
      "sources": []
    },
    "Economic": {
      "value": 7,
      "confidence": "medium",
      "rationale": "To be documented. Researchers are invited to submit citations via pull request.",
      "sources": []
    },
    "Class": {
      "value": 5,
      "confidence": "medium",
      "rationale": "To be documented. Researchers are invited to submit citations via pull request.",
      "sources": []
    },
    "Governance": {
      "value": 6,
      "confidence": "medium",
      "rationale": "To be documented. Researchers are invited to submit citations via pull request.",
      "sources": []
    }
  },
  "responses": {
    "Q1": {
      "value": 0,
      "confidence": "medium",
      "rationale": "Inferred from Cultural axis score of 4.",
      "sources": []
    },
    "Q2": {
      "value": 1,
      "confidence": "medium",
      "rationale": "Inferred from Cultural axis score of 4.",
      "sources": []
    },
    "Q3": {
      "value": 0,
      "confidence": "medium",
      "rationale": "Inferred from Cultural axis score of 4.",
      "sources": []
    },
    "Q4": {
      "value": 1,
      "confidence": "medium",
      "rationale": "Inferred from Cultural axis score of 4.",
      "sources": []
    },
    "Q5": {
      "value": 1,
      "confidence": "medium",
      "rationale": "Inferred from Economic axis score of 7.",
      "sources": []
    },
    "Q6": {
      "value": 0,
      "confidence": "medium",
      "rationale": "Inferred from Economic axis score of 7.",
      "sources": []
    },
    "Q7": {
      "value": 2,
      "confidence": "medium",
      "rationale": "Inferred from Economic axis score of 7.",
      "sources": []
    },
    "Q8": {
      "value": 0,
      "confidence": "medium",
      "rationale": "Inferred from Economic axis score of 7.",
      "sources": []
    },
    "Q9": {
      "value": 0,
      "confidence": "medium",
      "rationale": "Inferred from Military axis score of 8.",
      "sources": []
    },
    "Q10": {
      "value": 2,
      "confidence": "medium",
      "rationale": "Inferred from Military axis score of 8.",
      "sources": []
    },
    "Q11": {
      "value": 3,
      "confidence": "medium",
      "rationale": "Inferred from Military axis score of 8.",
      "sources": []
    },
    "Q12": {
      "value": 0,
      "confidence": "medium",
      "rationale": "Inferred from Military axis score of 8.",
      "sources": []
    },
    "Q13": {
      "value": 0,
      "confidence": "medium",
      "rationale": "Inferred from Sovereignty axis score of 5.",
      "sources": []
    },
    "Q14": {
      "value": 0,
      "confidence": "medium",
      "rationale": "Inferred from Sovereignty axis score of 5.",
      "sources": []
    },
    "Q15": {
      "value": 0,
      "confidence": "medium",
      "rationale": "Inferred from Sovereignty axis score of 5.",
      "sources": []
    },
    "Q16": {
      "value": 0,
      "confidence": "medium",
      "rationale": "Inferred from Sovereignty axis score of 5.",
      "sources": []
    },
    "Q17": {
      "value": 0,
      "confidence": "medium",
      "rationale": "Inferred from Governance axis score of 6.",
      "sources": []
    },
    "Q18": {
      "value": 1,
      "confidence": "medium",
      "rationale": "Inferred from Governance axis score of 6.",
      "sources": []
    },
    "Q19": {
      "value": 0,
      "confidence": "medium",
      "rationale": "Inferred from Governance axis score of 6.",
      "sources": []
    },
    "Q20": {
      "value": 1,
      "confidence": "medium",
      "rationale": "Inferred from Governance axis score of 6.",
      "sources": []
    },
    "Q21": {
      "value": 0,
      "confidence": "medium",
      "rationale": "Inferred from Class axis score of 5.",
      "sources": []
    },
    "Q22": {
      "value": 0,
      "confidence": "medium",
      "rationale": "Inferred from Class axis score of 5.",
      "sources": []
    },
    "Q23": {
      "value": 0,
      "confidence": "medium",
      "rationale": "Inferred from Class axis score of 5.",
      "sources": []
    },
    "Q24": {
      "value": 0,
      "confidence": "medium",
      "rationale": "Inferred from Class axis score of 5.",
      "sources": []
    }
  }
}
